ItemCliente;ItemSmarkets;CodigoPDM;TituloPDM;TextLongoPDM;NCM;Status
ABRACADEIRA T30R I446 14CM PCT 500;ABRACADEIRA T30R I446 14CM PCT 500;ABNME;ABRACADEIRA NAO METALICA;;3926.90.90;PARCIAL
AGENDA ANUAL 2019;AGENDA ANUAL 2019;AGENB;AGENDA;"AGENDA; MODELO ANUAL; CAPA; COR CAPA; MATERIAL MIOLO; DIMENSOES; QUANTIDADE PAGINAS; CARACTERISTICAS ESPECIAIS; FORMA FORNECIMENTO; FABRICANTE-REFERENCIA";4820.10.00;PARCIAL
ALMOFADA P/ CARIMBO N.2 AZUL;ALMOFADA P/ CARIMBO N.2 AZUL;ACARI;ALMOFADA CARIMBO;"ALMOFADA/REFIL CARIMBO; TIPO MANUAL; MODELO CARIMBO NUMERO 2; DIMENSAO 59 X 94MM; COR TINTA AZUL";9612.20.00;TOTAL
APAGADOR MAGNETICO P/ QDO BRANCO;APAGADOR MAGNETICO P/ QDO BRANCO;APAGA;APAGADOR QUADRO;"APAGADOR QUADRO; MATERIAL; COR; BASE; DIMENSOES; APLICACAO QUADRO BRANCO";;PARCIAL
APLICADOR DE COLA QUENTE PEQUENO S-468;APLICADOR DE COLA QUENTE PEQUENO S-468;SEM PDM;SEM PDM;;;BACKLOG
APOIO P/ TECLADO ERGON.;APOIO P/ TECLADO ERGON.;SEM PDM;SEM PDM;;;BACKLOG
APONTADOR C/DEPOSITO I-GLOO 1 FURO634754;APONTADOR C/DEPOSITO I-GLOO 1 FURO634754;APONT;APONTADOR;"APONTADOR; TIPO MANUAL; MATERIAL CORPO PLASTICO; COR AZUL, MATERIAL LAMINA ACO, FORMATO ERGONOMICO; DEPOSITO COM DEPOSITO; FABRICANTE-REFERENCIA MAPED-IGLOO 634754";;TOTAL
APONTADOR PLÁSTICO SIMPLES REDONDO;APONTADOR PLÁSTICO SIMPLES REDONDO;APONT;APONTADOR;"APONTADOR; TIPO MANUAL; MATERIAL CORPO PLASTICO; COR , MATERIAL LAMINA ACO, FORMATO REDONDO; DEPOSITO";;PARCIAL
AQUARELA 12 CORES + 1 PINCEL 01812 ACRIL;AQUARELA 12 CORES + 1 PINCEL 01812 ACRIL;SEM PDM;SEM PDM;;;BACKLOG
ARQUIVO MORTO PAPELÃO PADRÃO;ARQUIVO MORTO PAPELÃO PADRÃO;CAMOR;CAIXA ARQUIVO MORTO;"CAIXA ARQUIVO MORTO; MODELO ; MATERIAL PAPELAO; GRAMATURA ; IMPRESSAO ; VISOR ; QUANTIDADE IMPRESSAO ; COR PARDO; DIMENSOES";4819.10.00;PARCIAL
ARQUIVO MORTO POLIONDA PADRAO    VM;ARQUIVO MORTO POLIONDA PADRAO    VM;CAMOR;CAIXA ARQUIVO MORTO;"CAIXA ARQUIVO MORTO; MODELO ; MATERIAL POLIPROPILENO CORRUGADO (POLIONDA); GRAMATURA ; IMPRESSAO ; VISOR ; QUANTIDADE IMPRESSAO ; COR VERMELHO; DIMENSOES";3923.10.90;PARCIAL
BALÃO CORES SORTIDAS N.9 C/50 HAPPY DAY;BALÃO CORES SORTIDAS N.9 C/50 HAPPY DAY;SEM PDM;SEM PDM;;;BACKLOG
BALÃO CORES SORTIDAS PCT C/50 UNID NR 7;BALÃO CORES SORTIDAS PCT C/50 UNID NR 7;SEM PDM;SEM PDM;;;BACKLOG
BALÃO PALITO LISO CORES SORTIDAS C/25 UN;BALÃO PALITO LISO CORES SORTIDAS C/25 UN;SEM PDM;SEM PDM;;;BACKLOG
BARBANTE 6 FIOS 85% ALGODÃO C/101 MTS;BARBANTE 6 FIOS 85% ALGODÃO C/101 MTS;BARBA;BARBANTE;"BARBANTE; COMPOSICAO 85% ALGODAO; ACABAMENTO; COR; ESPESSURA FIO ÚNICO; NUMERO FIOS 6 FIOS; COMPRIMENTO 101M; PESO; FABRICANTE; REFERENCIA";5204.19.20;PARCIAL
BASTAO COLA QUENTE 11,5MM;BASTAO COLA QUENTE 11,5MM;BCQUN;BASTAO COLA QUENTE;"BASTAO COLA QUENTE; DIAMETRO 11,5MM; COMPRIMENTO; COR BRANCO; FORMA FORNECIMENTO";;PARCIAL
BASTAO COLA QUENTE 7,5MM;BASTAO COLA QUENTE 7,5MM;BCQUN;BASTAO COLA QUENTE;"BASTAO COLA QUENTE; DIAMETRO 7,5MM; COMPRIMENTO; COR BRANCO; FORMA FORNECIMENTO";;PARCIAL
BATERIA 9V ALCALINA;BATERIA 9V ALCALINA;BPELE;BATERIA, PILHA ELETROELETRONICA;"BATERIA, PILHA ELETROELETRONICA; COMPOSICAO QUIMICA ALCALINA; TAMANHO 9V; FORMATO RETANGULAR; TENSAO NOMINAL 9V; CAPACIDADE CORRENTE ; CARGA NAO RECARREGAVEL; FORNECIMENTO CARTELA 1 UNIDADE";8506.10.10;TOTAL
BATERIA LITIO CR 2032 3V;BATERIA LITIO CR 2032 3V;BPELE;BATERIA, PILHA ELETROELETRONICA;"BATERIA, PILHA ELETROELETRONICA; COMPOSICAO QUIMICA LITHIUM; TAMANHO CR2032; FORMATO BOTAO; TENSAO NOMINAL 3V; CAPACIDADE CORRENTE ; CARGA NAO RECARREGAVEL";8506.50.90;TOTAL
BATERIA LITIO CR123A 3V;BATERIA LITIO CR123A 3V;BPELE;BATERIA, PILHA ELETROELETRONICA;"BATERIA, PILHA ELETROELETRONICA; COMPOSICAO QUIMICA LITHIUM; TAMANHO CR123A; FORMATO BOTAO; TENSAO NOMINAL 3V; CAPACIDADE CORRENTE ; CARGA RECARREGAVEL; FORNECIMENTO CARTELA 1 UNIDADE";8506.50.90;TOTAL
BLOCO  ADESIVO PARA RECADOS  38MM X 50MM;BLOCO  ADESIVO PARA RECADOS  38MM X 50MM;ADAVI;ADESIVO AVISO (POST-IT);"ADESIVO AVISO (POST-IT); TAMANHO 38 X 50MM; COR AMARELO; FORNECIMENTO 100 FOLHAS";4821.10.00;TOTAL
BLOCO  ADESIVO PARA RECADOS  GRANDE 76MM;BLOCO  ADESIVO PARA RECADOS  GRANDE 76MM;ADAVI;ADESIVO AVISO (POST-IT);"ADESIVO AVISO (POST-IT); TAMANHO 76 X 76MM; COR ; FORNECIMENTO 100 FOLHAS";4821.10.00;PARCIAL
BLOCO DESENHO A3 BRANCO;BLOCO DESENHO A3 BRANCO;SEM PDM;SEM PDM;;;BACKLOG
BLOCO ECOCORES TEX 180G 230X320MM C/7 C;BLOCO ECOCORES TEX 180G 230X320MM C/7 C;PTEXT;PAPEL TEXTURA;"PAPEL TEXTURA; ACABAMENTO ESTAMPADO; DIMENSAO 230 X 320MM; GRAMATURA 180G/M²; COR 7 CORES; FORNECIMENTO 36 FOLHA";4802.57.90;TOTAL
BLOCO FLIP CHART C/PICOTE  50FL;BLOCO FLIP CHART C/PICOTE  50FL;PFCHA;PAPEL FLIP CHART;"PAPEL FLIP CHART; LARGURA 640MM; COMPRIMENTO 880MM; GRAMATURA 75G/M²; COR BRANCO; FURO 2 FUROS; QUANTIDADE FOLHAS 50";4820.90.00;TOTAL
BLOCO REC POST-IT AZUL C/45 FLS 654 3M -;BLOCO REC POST-IT AZUL C/45 FLS 654 3M -;ADAVI;ADESIVO AVISO (POST-IT);"ADESIVO AVISO (POST-IT); TAMANHO 76 X 76MM; COR AZUL ; FORNECIMENTO 45 FOLHAS; FABRICANTE-REFERENCIA 3M-654";4821.10.00;TOTAL
BLOCO REC POST-IT LARANJA C/ 90 FLS 654;BLOCO REC POST-IT LARANJA C/ 90 FLS 654;ADAVI;ADESIVO AVISO (POST-IT);"ADESIVO AVISO (POST-IT); TAMANHO 76 X 76MM; COR LARANJA ; FORNECIMENTO 90 FOLHAS; FABRICANTE-REFERENCIA 3M-654";4821.10.00;TOTAL
BLOCO REC POST-IT ROSA C/45 FLS 654 3M -;BLOCO REC POST-IT ROSA C/45 FLS 654 3M -;ADAVI;ADESIVO AVISO (POST-IT);"ADESIVO AVISO (POST-IT); TAMANHO 76 X 76MM; COR ROSA ; FORNECIMENTO 45 FOLHAS; FABRICANTE-REFERENCIA 3M-654";4821.10.00;TOTAL
BOBINA DE PAPEL KRAFT;BOBINA DE PAPEL KRAFT 1,2M X 200M X 80G;PKRAF;PAPEL KRAFT;"PAPEL KRAFT; COR NATURAL; GRAMATURA 80G/M²; LARGURA 1,20M; COMPRIMENTO 200M; FORNECIMENTO BOBINA ";;TOTAL
BOBINA PAPEL TÉRMICO 57MMX300M CX C/ 04;BOBINA PAPEL TÉRMICO 57MMX300M CX C/ 04;PTERM;PAPEL TERMICO;"PAPEL TERMICO; APLICACAO RELOGIO PONTO; DIMENSAO 57MM X 300M; COR AMARELO; FORMA FORNECIMENTO CAIXA 4 ROLOS";4811.90.90;TOTAL
BOBINA PAPEL TÉRMICO 80MM X 50M CX C/ 30;BOBINA PAPEL TÉRMICO 80MM X 50M CX C/ 30;PTERM;PAPEL TERMICO;"PAPEL TERMICO; APLICACAO; DIMENSAO 57MM X 300M; COR; FORMA FORNECIMENTO CAIXA 30 ROLOS";4811.90.90;PARCIAL
BOBINA PAPEL TÉRMICO 80MM X 80M CX C/ 20;BOBINA PAPEL TÉRMICO 80MM X 80M CX C/ 20;PTERM;PAPEL TERMICO;"PAPEL TERMICO; APLICACAO; DIMENSAO 80MM X 80M; COR; FORMA FORNECIMENTO CAIXA 20 ROLOS";4811.90.90;PARCIAL
BORRACHA BRANCA COM CAPA;BORRACHA BRANCA COM CAPA;BESCR;BORRACHA ESCOLAR;"BORRACHA ESCOLAR; MATERIAL; FORMATO; COR BRANCO; APLICACAO LAPIS; CAPA COM CAPA; DIMENSOES; FORNECIMENTO";;PARCIAL
BORRACHA BRANCA N 20 RED BOR;BORRACHA BRANCA N 20 RED BOR;BESCR;BORRACHA ESCOLAR;"BORRACHA ESCOLAR; MATERIAL BORRACHA NATURAL; FORMATO RETANGULAR; COR BRANCO; APLICACAO LAPIS; CAPA SEM CAPA; DIMENSOES 40 X 20 X 7MM; FABRICANTE-REFERENCIA RED BOR-BR20";;TOTAL
CADERNO 1/4 ESPIRAL CAPA DURA 96FLS TILI;CADERNO 1/4 ESPIRAL CAPA DURA 96FLS TILI;CADER;CADERNO;"CADERNO; MODELO UNIVERSITARIO; ENCADERNACAO ESPIRAL; TIPO CAPA CAPA DURA; ACABAMENTO CAPA PERSONALIZADO; TIPO FOLHA COM PAUTA; DIMENSOES 140 X 200MM; QUANTIDADE FOLHA 96 FOLHAS";4820.20.00;TOTAL
CADERNO BROCH CD  1/4 AZ 96FL;CADERNO BROCHURA CD  1/4 AZ 96FL;CADER;CADERNO;"CADERNO; MODELO UNIVERSITARIO; ENCADERNACAO BROCHURA COLADO; TIPO CAPA CAPA DURA; ACABAMENTO CAPA LISA AZUL; TIPO FOLHA COM PAUTA; DIMENSOES 140 X 200MM; QUANTIDADE FOLHA 96FOLHAS";4820.20.00;TOTAL
CADERNO CAPA DURA 1/4 100 FOLHAS;CADERNO CAPA DURA 1/4 100 FOLHAS;CADER;CADERNO;"CADERNO; MODELO ; ENCADERNACAO ; TIPO CAPA CAPA DURA;  TIPO FOLHA COM PAUTA; DIMENSOES 140 X 200MM; QUANTIDADE FOLHA 100 FOLHAS";4820.20.00;PARCIAL
CADERNO CAPA DURA 1/4 200 FOLHAS;CADERNO CAPA DURA 1/4 200 FOLHAS;CADER;CADERNO;"CADERNO; MODELO ; ENCADERNACAO ; TIPO CAPA CAPA DURA;  TIPO FOLHA COM PAUTA; DIMENSOES 140 X 200MM; QUANTIDADE FOLHA 200 FOLHAS";4820.20.00;PARCIAL
CADERNO DE PROTOCOLO COM 100 FOLHAS;CADERNO DE PROTOCOLO COM 100 FOLHAS;CADER;CADERNO;"CADERNO; MODELO PROTOCOLO; ENCADERNACAO BROCHURA COLADO; TIPO CAPA CAPA DURA; ACABAMENTO CAPA PERSONALIZADO; TIPO FOLHA COM PAUTA; DIMENSOES ; QUANTIDADE FOLHA 100 FOLHAS";4820.20.00;PARCIAL
CADERNO UNIV  CP DURA 96FL;CADERNO UNIV  CP DURA 96FL;CADER;CADERNO;"CADERNO; MODELO UNIVERSITARIO; ENCADERNACAO ; TIPO CAPA CAPA DURA; ACABAMENTO CAPA ; TIPO FOLHA COM PAUTA; DIMENSOES MM; QUANTIDADE FOLHA 96 FOLHAS";4820.20.00;PARCIAL
CADERNO UNIV CP FLEX 96FL;CADERNO UNIV CP FLEX 96FL;CADER;CADERNO;"CADERNO; MODELO UNIVERSITARIO; ENCADERNACAO ; TIPO CAPA CAPA FLEXIVEL; ACABAMENTO CAPA ; TIPO FOLHA COM PAUTA; DIMENSOES MM; QUANTIDADE FOLHA 96 FOLHAS";4820.20.00;PARCIAL
CADERNO UNIVERSITARIO CAPA DURA 200 FLS;CADERNO UNIVERSITARIO CAPA DURA 200 FLS;CADER;CADERNO;"CADERNO; MODELO UNIVERSITARIO; ENCADERNACAO ; TIPO CAPA CAPA DURA; ACABAMENTO CAPA ; TIPO FOLHA COM PAUTA; DIMENSOES MM; QUANTIDADE FOLHA 200 FOLHAS";4820.20.00;PARCIAL
CAIXA  EM ACRILICO C/ DUPLA FACE;CAIXA  EM ACRILICO C/ DUPLA FACE;SEM PDM;SEM PDM;;;BACKLOG
CAIXA ARQUIVO DELLO COLOR BRANCA;CAIXA ARQUIVO DELLO COLOR BRANCA;ARQUI;ARQUIVO PASTA SUSPENSA/FICHARIO;"ARQUIVO PASTA SUSPENSA; MATERIAL; ACABAMENTO; COR BRANCO; DIMENSAO; TIPO GAVETA; QUANTIDADE GAVETA; PUXADOR; FECHAMENTO; FABRICANTE-REFERENCIA";;PARCIAL
CAIXA ARQUIVO DELLO COLOR PRETA;CAIXA ARQUIVO DELLO COLOR PRETA;ARQUI;ARQUIVO PASTA SUSPENSA/FICHARIO;"ARQUIVO PASTA SUSPENSA; MATERIAL; ACABAMENTO; COR PRETO; DIMENSAO; TIPO GAVETA; QUANTIDADE GAVETA; PUXADOR; FECHAMENTO; FABRICANTE-REFERENCIA";;PARCIAL
CAIXA BOX MULTIUSO DSK316 GDE  AZ;CAIXA BOX MULTIUSO DSK316 GDE  AZ;SEM PDM;SEM PDM;;;BACKLOG
CAIXA CORRESP DUPLA CR MOVEL;CAIXA CORRESP DUPLA CR MOVEL;CCORE;CAIXA CORRESPONDENCIA;"CAIXA CORRESPONDENCIA; TIPO DUPLA MOVEL; MATERIAL ACRILICO; DIMENSAO; COR CRISTAL";3926.10.00;PARCIAL
CAIXA CORRESP DUPLA FIXA CRISTAL;CAIXA CORRESP DUPLA FIXA CRISTAL;CCORE;CAIXA CORRESPONDENCIA;"CAIXA CORRESPONDENCIA; TIPO DUPLA FIXA; MATERIAL ACRILICO; DIMENSAO; COR CRISTAL";3926.10.00;PARCIAL
CAIXA ORGANIZADORA OFFICE 30 LITROS TRAS;CAIXA ORGANIZADORA OFFICE 30 LITROS TRAS;CORGA;CAIXA ORGANIZADORA;"CAIXA ORGANIZADORA; MATERIAL POLIPROPILENO; COR TRANSPARENTE; TAMPA COM TAMPA; COR TAMPA TRANSPARENTE; ALTURA 304MM; DIMENSOES 355 X 416MM; TIPO ABERTURA SUPERIOR; TIPO FECHAMENTO 2 TRAVAS; ALCA 2 ALCAS; QUANTIDADE DIVISOES 1";3923.10.90;TOTAL
CAIXA ORGANIZADORA POLIONDA CR PEQ 335X2;CAIXA ORGANIZADORA POLIONDA CR PEQ 335X2;CORGA;CAIXA ORGANIZADORA;"CAIXA ORGANIZADORA; MATERIAL POLIONDA; COR CRISTAL; TAMPA COM TAMPA; COR TAMPA CRISTAL; ALTURA 180MM; DIMENSOES 335 X 255MM; TIPO ABERTURA SUPERIOR; TIPO FECHAMENTO ENCAIXE; ALCA 2 ALCAS; QUANTIDADE DIVISOES 1";3923.10.90;TOTAL
CAIXA P/ ARQUIVO MORTO PLASTICA - AMAREL;CAIXA P/ ARQUIVO MORTO PLASTICA - AMAREL;CAMOR;CAIXA ARQUIVO MORTO;"CAIXA ARQUIVO MORTO; MODELO ; MATERIAL PLASTICO; GRAMATURA ; IMPRESSAO ; VISOR ; QUANTIDADE IMPRESSAO ; COR AMARELO; DIMENSOES";3923.10.90;PARCIAL
CAIXA P/ ARQUIVO MORTO PLASTICA - AZUL;CAIXA P/ ARQUIVO MORTO PLASTICA - AZUL;CAMOR;CAIXA ARQUIVO MORTO;"CAIXA ARQUIVO MORTO; MODELO ; MATERIAL PLASTICO; GRAMATURA ; IMPRESSAO ; VISOR ; QUANTIDADE IMPRESSAO ; COR AZUL; DIMENSOES";3923.10.90;PARCIAL
CAIXA P/ ARQUIVO MORTO PLASTICA - BRANCA;CAIXA P/ ARQUIVO MORTO PLASTICA - BRANCA;CAMOR;CAIXA ARQUIVO MORTO;"CAIXA ARQUIVO MORTO; MODELO ; MATERIAL PLASTICO; GRAMATURA ; IMPRESSAO ; VISOR ; QUANTIDADE IMPRESSAO ; COR BRANCO; DIMENSOES";3923.10.90;PARCIAL
CAIXA P/ ARQUIVO MORTO PLASTICA - CINZA;CAIXA P/ ARQUIVO MORTO PLASTICA - CINZA;CAMOR;CAIXA ARQUIVO MORTO;"CAIXA ARQUIVO MORTO; MODELO ; MATERIAL PLASTICO; GRAMATURA ; IMPRESSAO ; VISOR ; QUANTIDADE IMPRESSAO ; COR CINZA; DIMENSOES";3923.10.90;PARCIAL
CAIXA P/ ARQUIVO MORTO PLASTICA - LARANJ;CAIXA P/ ARQUIVO MORTO PLASTICA - LARANJ;CAMOR;CAIXA ARQUIVO MORTO;"CAIXA ARQUIVO MORTO; MODELO ; MATERIAL PLASTICO; GRAMATURA ; IMPRESSAO ; VISOR ; QUANTIDADE IMPRESSAO ; COR LARANJA; DIMENSOES";3923.10.90;PARCIAL
CAIXA P/ ARQUIVO MORTO PLASTICA - PRETA;CAIXA P/ ARQUIVO MORTO PLASTICA - PRETA;CAMOR;CAIXA ARQUIVO MORTO;"CAIXA ARQUIVO MORTO; MODELO ; MATERIAL PLASTICO; GRAMATURA ; IMPRESSAO ; VISOR ; QUANTIDADE IMPRESSAO ; COR PRETO; DIMENSOES";3923.10.90;PARCIAL
CAIXA P/ ARQUIVO MORTO PLASTICA - ROSA;CAIXA P/ ARQUIVO MORTO PLASTICA - ROSA;CAMOR;CAIXA ARQUIVO MORTO;"CAIXA ARQUIVO MORTO; MODELO ; MATERIAL PLASTICO; GRAMATURA ; IMPRESSAO ; VISOR ; QUANTIDADE IMPRESSAO ; COR ROSA; DIMENSOES";3923.10.90;PARCIAL
CAIXA P/ ARQUIVO MORTO PLASTICA - VERDE;CAIXA P/ ARQUIVO MORTO PLASTICA - VERDE;CAMOR;CAIXA ARQUIVO MORTO;"CAIXA ARQUIVO MORTO; MODELO ; MATERIAL PLASTICO; GRAMATURA ; IMPRESSAO ; VISOR ; QUANTIDADE IMPRESSAO ; COR VERDE; DIMENSOES";3923.10.90;PARCIAL
CAIXA P/ ARQUIVO MORTO PLASTICA - VERMEL;CAIXA P/ ARQUIVO MORTO PLASTICA - VERMEL;CAMOR;CAIXA ARQUIVO MORTO;"CAIXA ARQUIVO MORTO; MODELO ; MATERIAL PLASTICO; GRAMATURA ; IMPRESSAO ; VISOR ; QUANTIDADE IMPRESSAO ; COR VERMELHO; DIMENSOES";3923.10.90;PARCIAL
CAIXA PLASTICA 2,3L REF. 950 SAN REMO;CAIXA PLASTICA 2,3L REF. 950 SAN REMO;CORGA;CAIXA ORGANIZADORA;"CAIXA ORGANIZADORA; MATERIAL PLASTICO; COR TRANSPARENTE; TAMPA COM TAMPA; COR TAMPA TRANSPARENTE; DIMENSOES 262 X 177 X 85MM; TIPO ABERTURA SUPERIOR; TIPO FECHAMENTO 4 TRAVAS; ALCA SEM ALCA; QUANTIDADE DIVISOES 1; FABRICANTE-REFERENCIA SANREMO-950 2,3L";3923.10.90;TOTAL
CAIXA PLASTICA 4,2L REF. 6625 PLASUTIL;CAIXA PLASTICA 4,2L REF. 6625 PLASUTIL;CORGA;CAIXA ORGANIZADORA;"CAIXA ORGANIZADORA; MATERIAL PLASTICO; COR ; TAMPA ; COR TAMPA ; DIMENSOES MM; TIPO ABERTURA ; TIPO FECHAMENTO ; ALCA ; QUANTIDADE DIVISOES ; FABRICANTE-REFERENCIA PLASUTIL-6625 4,2L";3923.10.90;PARCIAL
CAIXA PLASTICA 42L REF. 980 SAN REMO;CAIXA PLASTICA 42L REF. 980 SAN REMO;CORGA;CAIXA ORGANIZADORA;"CAIXA ORGANIZADORA; MATERIAL PLASTICO; COR TRANSPARENTE; TAMPA COM TAMPA; COR TAMPA TRANSPARENTE; DIMENSOES 650 X 445 X 245MM; TIPO ABERTURA SUPERIOR; TIPO FECHAMENTO 4 TRAVAS; ALCA SEM ALCA; QUANTIDADE DIVISOES 1; FABRICANTE-REFERENCIA SANREMO-980 42L";3923.10.90;TOTAL
CAIXA PLASTICA 8,6L REF. 960 SAN REMO;CAIXA PLASTICA 8,6L REF. 960 SAN REMO;CORGA;CAIXA ORGANIZADORA;"CAIXA ORGANIZADORA; MATERIAL PLASTICO; COR TRANSPARENTE; TAMPA COM TAMPA; COR TAMPA TRANSPARENTE; DIMENSOES 400 X 270 X 133MM; TIPO ABERTURA SUPERIOR; TIPO FECHAMENTO 4 TRAVAS; ALCA SEM ALCA; QUANTIDADE DIVISOES 1; FABRICANTE-REFERENCIA SANREMO-960 8,6L";3923.10.90;TOTAL
CAIXA PLASTICA BIOPRATIKA 16.5L PLEION;CAIXA PLASTICA BIOPRATIKA 16.5L PLEION;CORGA;CAIXA ORGANIZADORA;"CAIXA ORGANIZADORA; MATERIAL PLASTICO; COR BRANCO; TAMPA COM TAMPA; COR TAMPA BRANCO; DIMENSOES 13,20 X 33,80 X 54,40CM; TIPO ABERTURA SUPERIOR; TIPO FECHAMENTO ENCAIXE; ALCA 2 ALCAS; QUANTIDADE DIVISOES 1; FABRICANTE-REFERENCIA PLEION-BIOPRATIKA 0630 16,5L";3923.10.90;TOTAL
CAIXA PLASTICA BIOPRATIKA C/ TAMPA 5L PL;CAIXA PLASTICA BIOPRATIKA C/ TAMPA 5L PL;CORGA;CAIXA ORGANIZADORA;"CAIXA ORGANIZADORA; MATERIAL PLASTICO; COR BRANCO; TAMPA COM TAMPA; COR TAMPA BRANCO; DIMENSOES 12,80 X 17,00 X 33,70CM; TIPO ABERTURA SUPERIOR; TIPO FECHAMENTO ENCAIXE; ALCA 2 ALCAS; QUANTIDADE DIVISOES 1; FABRICANTE-REFERENCIA PLEION-BIOPRATIKA 0510 5L";3923.10.90;TOTAL
CAIXA PLASTICA ORDENE REF 22050;CAIXA PLASTICA ORDENE REF 22050;CORGA;CAIXA ORGANIZADORA;"CAIXA ORGANIZADORA; MATERIAL PLASTICO; COR CRISTAL; TAMPA COM TAMPA; COR TAMPA CRISTAL; DIMENSOES 16 X 43 X 63,50CM; TIPO ABERTURA SUPERIOR; TIPO FECHAMENTO ENCAIXE; ALCA SEM ALCA; QUANTIDADE DIVISOES 1; FABRICANTE-REFERENCIA ORDENE-22050";3923.10.90;TOTAL
CAIXA PLASTICA ORGANIZADORA 10L REF 101;CAIXA PLASTICA ORGANIZADORA 10L REF 101;CORGA;CAIXA ORGANIZADORA;"CAIXA ORGANIZADORA; MATERIAL PLASTICO; COR ; TAMPA ; COR TAMPA ; DIMENSOES MM; TIPO ABERTURA ; TIPO FECHAMENTO ; ALCA ; QUANTIDADE DIVISOES ; FABRICANTE-REFERENCIA";3923.10.90;PARCIAL
CAIXA PLASTICA ORGANIZADORA 10LITROS;CAIXA PLASTICA ORGANIZADORA 10LITROS;CORGA;CAIXA ORGANIZADORA;"CAIXA ORGANIZADORA; MATERIAL PLASTICO; COR ; TAMPA ; COR TAMPA ; DIMENSOES MM; TIPO ABERTURA ; TIPO FECHAMENTO ; ALCA ; QUANTIDADE DIVISOES ;";3923.10.90;PARCIAL
CAIXA PLASTICA ORGANIZADORA 5L REF 217;CAIXA PLASTICA ORGANIZADORA 5L REF 217;CORGA;CAIXA ORGANIZADORA;"CAIXA ORGANIZADORA; MATERIAL PLASTICO; COR ; TAMPA ; COR TAMPA ; DIMENSOES MM; TIPO ABERTURA ; TIPO FECHAMENTO ; ALCA ; QUANTIDADE DIVISOES ;;";3923.10.90;PARCIAL
CAIXAS DE GIZ DE LOUSA COLORIDO;CAIXAS DE GIZ DE LOUSA COLORIDO;SEM PDM;SEM PDM;;;BACKLOG
CAIXAS DE LÁPIS DE COR BIC EVOLUTION PIJ;CAIXAS DE LÁPIS DE COR BIC EVOLUTION PIJ;LCOR;LAPIS COR;"LAPIS COR; TAMANHO; FORMATO; COR; FORMA FORNECIMENTO; FABRICANTE-REFERENCIA BIC-EVOLUTION PIJAMA";9609.10.00;PARCIAL
CALCULADORA DE BOLSO 8 DIGITOS CB-1483 -;CALCULADORA DE BOLSO 8 DIGITOS CB-1483 -;CALCU;CALCULADORA;"CALCULADORA; VISOR CRISTAL LIQUIDO-LCD; POSICAO VISOR PLANO; NUMERO DIGITO 8 DIGITOS; CAPACIDADE MEMORIA COM MEMORIA; IMPRESSAO SEM IMPRESSAO; FUNCOES 4 OPERACOES; DIMENSOES 115 X 64 X 21MM; COR PRETO; ALIMENTACAO PILHA/SOLAR; FABRICANTE-REFERENCIA ELGIN-CB1483";8470.10.00;TOTAL
CALCULADORA MESA 12DIGITOS ELGIN;CALCULADORA MESA 12DIGITOS ELGIN;CALCU;CALCULADORA;"CALCULADORA; VISOR CRISTAL LIQUIDO-LCD; POSICAO VISOR INCLINADO; NUMERO DIGITO 12 DIGITOS; CAPACIDADE MEMORIA COM MEMORIA; IMPRESSAO SEM IMPRESSAO; FUNCOES 4 OPERACOES; DIMENSOES 106 X 142 X 25MM; COR CINZA; ALIMENTACAO PILHA/SOLAR; FABRICANTE-REFERENCIA ELGIN-MV4122";8470.10.00;TOTAL
CANETA BIC CRISTAL AZUL;CANETA BIC CRISTAL AZUL;CESFE;CANETA ESFEROGRAFICA;"CANETA ESFEROGRAFICA; MATERIAL CORPO PLASTICO RIGIDO; COR CORPO CRISTAL; FORMATO CORPO HEXAGONAL; ESPESSURA ESCRITA 1MM; COR ESCRITA AZUL; ACIONAMENTO CARGA RETRATIL; ACESSORIO ; FORNECIMENTO 1 UNIDADE; FABRICANTE-REFERENCIA BIC-CRISTAL";9608.10.00;TOTAL
CANETA BIC CRISTAL PRETA;CANETA BIC CRISTAL PRETA;CESFE;CANETA ESFEROGRAFICA;"CANETA ESFEROGRAFICA; MATERIAL CORPO PLASTICO RIGIDO; COR CORPO CRISTAL; FORMATO CORPO HEXAGONAL; ESPESSURA ESCRITA 1MM; COR ESCRITA PRETO; ACIONAMENTO CARGA RETRATIL; ACESSORIO ; FORNECIMENTO 1 UNIDADE; FABRICANTE-REFERENCIA BIC-CRISTAL";9608.10.00;TOTAL
CANETA BIC CRISTAL VERMELHA;CANETA BIC CRISTAL VERMELHA;CESFE;CANETA ESFEROGRAFICA;"CANETA ESFEROGRAFICA; MATERIAL CORPO PLASTICO RIGIDO; COR CORPO CRISTAL; FORMATO CORPO HEXAGONAL; ESPESSURA ESCRITA 1MM; COR ESCRITA VERMELHO; ACIONAMENTO CARGA RETRATIL; ACESSORIO ; FORNECIMENTO 1 UNIDADE; FABRICANTE-REFERENCIA BIC-CRISTAL";9608.10.00;TOTAL
CANETA FIXA COM CORRENTE;CANETA FIXA COM CORRENTE;CESFE;CANETA ESFEROGRAFICA;"CANETA ESFEROGRAFICA; MATERIAL CORPO METAL; COR CORPO ALUMINIO; FORMATO CORPO REDONDO; ESPESSURA ESCRITA MEDIA; COR ESCRITA AZUL; ACIONAMENTO CARGA RETRATIL; ACESSORIO CORRENTE; FORNECIMENTO 1 UNIDADE";9608.10.00;TOTAL
CANETA HID. OFFICE PEN 2.0MM AZ;CANETA HID. OFFICE PEN 2.0MM AZ;CHIDR;CANETA HIDROGRAFICA;"CANETA HIDROGRAFICA; MATERIAL CORPO PLASTICO; ESCRITA 2,0MM ; COR AZUL; FABRICANTE-REFERENCIA PILOT-OFFICE PEN";9608.20.00;TOTAL
CANETA HID. OFFICE PEN 2.0MM PT;CANETA HID. OFFICE PEN 2.0MM PT;CHIDR;CANETA HIDROGRAFICA;"CANETA HIDROGRAFICA; MATERIAL CORPO PLASTICO; ESCRITA 2,0MM ; COR PRETO; FABRICANTE-REFERENCIA PILOT-OFFICE PEN";9608.20.00;TOTAL
CANETA HID. OFFICE PEN 2.0MM VM;CANETA HID. OFFICE PEN 2.0MM VM;CHIDR;CANETA HIDROGRAFICA;"CANETA HIDROGRAFICA; MATERIAL CORPO PLASTICO; ESCRITA 2,0MM ; COR VERMELHO; FABRICANTE-REFERENCIA PILOT-OFFICE PEN";9608.20.00;TOTAL
CANETA IDENTIPEN  (E 12);CANETA IDENTIPEN  (E 12);MCANE;CANETA MARCADORA;"CANETA MARCADORA; TIPO MARCACAO PERMANENTE; TAMANHO PONTA 2 PONTAS 1 / 4MM; TINTA BASE ALCOOL; APLICACAO CD/DVD-VIDRO-PLASTICO-ACRILICO-VINIL; COR; FABRICANTE-REFERENCIA SAKURA-IDENT PEN";;PARCIAL
CANETA MARCA TEXTO - AMARELA;CANETA MARCA TEXTO - AMARELA;CMTEX;CANETA MARCA TEXTO;"CANETA MARCA TEXTO; MATERIAL CORPO PLASTICO; TIPO ; TIPO PONTA ; ESPESSURA PONTA ; COR AMARELO";9608.20.00;PARCIAL
CANETA MARCA TEXTO - AZUL;CANETA MARCA TEXTO - AZUL;CMTEX;CANETA MARCA TEXTO;"CANETA MARCA TEXTO; MATERIAL CORPO PLASTICO; TIPO ; TIPO PONTA ; ESPESSURA PONTA ; COR AZUL";9608.20.00;PARCIAL
CANETA MARCA TEXTO - LARANJA;CANETA MARCA TEXTO - LARANJA;CMTEX;CANETA MARCA TEXTO;"CANETA MARCA TEXTO; MATERIAL CORPO PLASTICO; TIPO ; TIPO PONTA ; ESPESSURA PONTA ; COR LARANJA";9608.20.00;PARCIAL
CANETA MARCA TEXTO - LILÁS;CANETA MARCA TEXTO - LILÁS;CMTEX;CANETA MARCA TEXTO;"CANETA MARCA TEXTO; MATERIAL CORPO PLASTICO; TIPO ; TIPO PONTA ; ESPESSURA PONTA ; COR LILAS";9608.20.00;PARCIAL
CANETA MARCA TEXTO - ROSA;CANETA MARCA TEXTO - ROSA;CMTEX;CANETA MARCA TEXTO;"CANETA MARCA TEXTO; MATERIAL CORPO PLASTICO; TIPO ; TIPO PONTA ; ESPESSURA PONTA ; COR ROSA";9608.20.00;PARCIAL
CANETA MARCA TEXTO - VERDE;CANETA MARCA TEXTO - VERDE;CMTEX;CANETA MARCA TEXTO;"CANETA MARCA TEXTO; MATERIAL CORPO PLASTICO; TIPO ; TIPO PONTA ; ESPESSURA PONTA ; COR VERDE";9608.20.00;PARCIAL
CANETA MARCA TEXTO - VERMELHO;CANETA MARCA TEXTO - VERMELHO;CMTEX;CANETA MARCA TEXTO;"CANETA MARCA TEXTO; MATERIAL CORPO PLASTICO; TIPO ; TIPO PONTA ; ESPESSURA PONTA ; COR VERMELHO";9608.20.00;PARCIAL
CANETA MARCADOR CDS/DVDS 1MM PRETA;CANETA MARCADOR CDS/DVDS 1MM PRETA;MCANE;CANETA MARCADORA;"CANETA MARCADORA; TIPO MARCACAO PERMANENTE; TAMANHO 1MM; TINTA BASE ALCOOL; APLICACAO CD/DVD-VIDRO-PLASTICO-ACRILICO-VINIL; COR PRETO";;TOTAL
CANETA MARCADOR QDO BRANCO AZUL;CANETA MARCADOR QDO BRANCO AZUL;MQBRA;PINCEL MARCADOR QUADRO BRANCO;"PINCEL QUADRO BRANCO; COR AZUL; TIPO ; MATERIAL PONTA ; ESPESSURA ESCRITA ; FABRICANTE-REFERENCIA";9608.20.00;PARCIAL
CANETA MARCADOR QDO BRANCO PRETO;CANETA MARCADOR QDO BRANCO PRETO;MQBRA;PINCEL MARCADOR QUADRO BRANCO;"PINCEL QUADRO BRANCO; COR PRETO; TIPO ; MATERIAL PONTA ; ESPESSURA ESCRITA ; FABRICANTE-REFERENCIA";9608.20.00;PARCIAL
CANETA MARCADOR QDO BRANCO VERDE;CANETA MARCADOR QDO BRANCO VERDE;MQBRA;PINCEL MARCADOR QUADRO BRANCO;"PINCEL QUADRO BRANCO; COR VERDE; TIPO ; MATERIAL PONTA ; ESPESSURA ESCRITA ; FABRICANTE-REFERENCIA";9608.20.00;PARCIAL
CANETA MARCADOR QDO BRANCO VERMELHO;CANETA MARCADOR QDO BRANCO VERMELHO;MQBRA;PINCEL MARCADOR QUADRO BRANCO;"PINCEL QUADRO BRANCO; COR VERMELHO; TIPO ; MATERIAL PONTA ; ESPESSURA ESCRITA ; FABRICANTE-REFERENCIA";9608.20.00;PARCIAL
CANETA P/RETRO PROJETOR PRETA;CANETA P/RETRO PROJETOR PRETA;CRPRO;CANETA RETROPROJETOR;"CANETA RETROPROJETOR, ESPESSURA PONTA; COR PRETO; BORRACHA SEM BORRACHA";9608.20.00;PARCIAL
CANETA RETROPROJETOR MED AZUL;CANETA RETROPROJETOR MED AZUL;CRPRO;CANETA RETROPROJETOR;"CANETA RETROPROJETOR, ESPESSURA PONTA (MEDIA) 2MM; COR AZUL; BORRACHA SEM BORRACHA";9608.20.00;TOTAL
CANETA RETROPROJETOR MED VERMELHA;CANETA RETROPROJETOR MED VERMELHA;CRPRO;CANETA RETROPROJETOR;"CANETA RETROPROJETOR, ESPESSURA PONTA (MEDIA) 2MM; COR VERMELHO; BORRACHA SEM BORRACHA";9608.20.00;TOTAL
CARBONO PAPEL OFICIO C/100FLS PRETO;CARBONO PAPEL OFICIO C/100FLS PRETO;SEM PDM;SEM PDM;;;BACKLOG
CARIMBO COLOP 10 - 10 X 26 MM;CARIMBO COLOP 10 - 10 X 26 MM;CESTO;CARIMBO ESTOJO/AUTOMATICO;"CARIMBO ESTOJO/AUTOMATICO; MODELO AUTO-ENTINTADO; COR ALMOFADA EMBUTIDA ; MATERIAL CORPO PLASTICO; FORMATO PLACA TEXTO RETANGULAR; DIMENSAO PLACA 10 X 26MM; FABRICANTE-REFERENCIA COLOP-C10";9611.00.00;PARCIAL
CARIMBO COLOP 15 - 10 X 70 MM;CARIMBO COLOP 15 - 10 X 70 MM;CESTO;CARIMBO ESTOJO/AUTOMATICO;"CARIMBO ESTOJO/AUTOMATICO; MODELO AUTO-ENTINTADO; COR ALMOFADA EMBUTIDA ; MATERIAL CORPO PLASTICO; FORMATO PLACA TEXTO RETANGULAR; DIMENSAO PLACA 10 X 70MM; FABRICANTE-REFERENCIA COLOP-C15";9611.00.00;PARCIAL
CARIMBO COLOP 20 - 14 X 38 MM;CARIMBO COLOP 20 - 14 X 38 MM;CESTO;CARIMBO ESTOJO/AUTOMATICO;"CARIMBO ESTOJO/AUTOMATICO; MODELO AUTO-ENTINTADO; COR ALMOFADA EMBUTIDA ; MATERIAL CORPO PLASTICO; FORMATO PLACA TEXTO RETANGULAR; DIMENSAO PLACA 14 X 38MM; FABRICANTE-REFERENCIA COLOP-C20";9611.00.00;PARCIAL
CARIMBO COLOP 25 - 15 X 75 MM;CARIMBO COLOP 25 - 15 X 75 MM;CESTO;CARIMBO ESTOJO/AUTOMATICO;"CARIMBO ESTOJO/AUTOMATICO; MODELO AUTO-ENTINTADO; COR ALMOFADA EMBUTIDA ; MATERIAL CORPO PLASTICO; FORMATO PLACA TEXTO RETANGULAR; DIMENSAO PLACA 15 X 75MM; FABRICANTE-REFERENCIA COLOP-C25";9611.00.00;PARCIAL
CARIMBO COLOP 30 - 18 X 47 MM;CARIMBO COLOP 30 - 18 X 47 MM;CESTO;CARIMBO ESTOJO/AUTOMATICO;"CARIMBO ESTOJO/AUTOMATICO; MODELO AUTO-ENTINTADO; COR ALMOFADA EMBUTIDA ; MATERIAL CORPO PLASTICO; FORMATO PLACA TEXTO RETANGULAR; DIMENSAO PLACA 18 X 47MM; FABRICANTE-REFERENCIA COLOP-C30";9611.00.00;PARCIAL
CARIMBO COLOP 40 - 22 X 58 MM;CARIMBO COLOP 40 - 22 X 58 MM;CESTO;CARIMBO ESTOJO/AUTOMATICO;"CARIMBO ESTOJO/AUTOMATICO; MODELO AUTO-ENTINTADO; COR ALMOFADA EMBUTIDA ; MATERIAL CORPO PLASTICO; FORMATO PLACA TEXTO RETANGULAR; DIMENSAO PLACA 22 X 58MM; FABRICANTE-REFERENCIA COLOP-C40";9611.00.00;PARCIAL
CARIMBO COLOP 45 - 25 X 82 MM;CARIMBO COLOP 45 - 25 X 82 MM;CESTO;CARIMBO ESTOJO/AUTOMATICO;"CARIMBO ESTOJO/AUTOMATICO; MODELO AUTO-ENTINTADO; COR ALMOFADA EMBUTIDA ; MATERIAL CORPO PLASTICO; FORMATO PLACA TEXTO RETANGULAR; DIMENSAO PLACA 25 X 82MM; FABRICANTE-REFERENCIA COLOP-C45";9611.00.00;PARCIAL
CARIMBO COLOP 50 - 25 X 70 MM;CARIMBO COLOP 50 - 25 X 70 MM;CESTO;CARIMBO ESTOJO/AUTOMATICO;"CARIMBO ESTOJO/AUTOMATICO; MODELO AUTO-ENTINTADO; COR ALMOFADA EMBUTIDA ; MATERIAL CORPO PLASTICO; FORMATO PLACA TEXTO RETANGULAR; DIMENSAO PLACA 25 X 70MM; FABRICANTE-REFERENCIA COLOP-C50";9611.00.00;PARCIAL
CARIMBO COLOP 52 - 20 X 30 MM;CARIMBO COLOP 52 - 20 X 30 MM;CESTO;CARIMBO ESTOJO/AUTOMATICO;"CARIMBO ESTOJO/AUTOMATICO; MODELO AUTO-ENTINTADO; COR ALMOFADA EMBUTIDA ; MATERIAL CORPO PLASTICO; FORMATO PLACA TEXTO RETANGULAR; DIMENSAO PLACA 20 X 30MM; FABRICANTE-REFERENCIA COLOP-C52";9611.00.00;PARCIAL
CARIMBO COLOP 53 - 30 X 45 MM;CARIMBO COLOP 53 - 30 X 45 MM;CESTO;CARIMBO ESTOJO/AUTOMATICO;"CARIMBO ESTOJO/AUTOMATICO; MODELO AUTO-ENTINTADO; COR ALMOFADA EMBUTIDA ; MATERIAL CORPO PLASTICO; FORMATO PLACA TEXTO RETANGULAR; DIMENSAO PLACA 30 X 45MM; FABRICANTE-REFERENCIA COLOP-C53";9611.00.00;PARCIAL
CARIMBO COLOP 55 - 40 X 60 MM;CARIMBO COLOP 55 - 40 X 60 MM;CESTO;CARIMBO ESTOJO/AUTOMATICO;"CARIMBO ESTOJO/AUTOMATICO; MODELO AUTO-ENTINTADO; COR ALMOFADA EMBUTIDA ; MATERIAL CORPO PLASTICO; FORMATO PLACA TEXTO RETANGULAR; DIMENSAO PLACA 40 X 60MM; FABRICANTE-REFERENCIA COLOP-C55";9611.00.00;PARCIAL
